{
    "$id": "https://github.com/edatasheets/edatasheets.github.io/blob/main/part-spec/component.json",
    "$schema": "https://json-schema.org/draft/2020-12/schema",
    "type": "object",
    "title": "component",
    "required": [
        "componentID"
    ],
    "properties": {
        "componentID": {
            "description": "methods for identifying the version of the electronic datasheet",
            "$ref": "./common/componentID.json#/componentID"
        },
        "coreProperties": {
            "description": "core component properties as defined by the specific component spec file",
            "$ref": "./common/coreProperties.json#/coreProperties"
        },
        "pins": {
            "description": "array of pin objects with associated properties",
            "type": "array",
            "items": {
                "$ref": "./common/pinSpec.json#/pinSpec"
            }
        },
        "package": {
            "description": "component package information",
            "$ref": "./common/package.json#/package"
        },
        "register": {
            "description": "register information",
            "$ref": "./common/register.json#/register"
        },
        "thermal": {
            "description": "component temperature and thermal resistance information",
            "$ref": "./common/thermal.json#/thermal"
        },
        "componentPropertyExternalFiles": {
            "description": "external files that describe key component properties. External files can be used in lieu of defining core properties, pins, and package information in the same file",
            "$ref": "./common/externalFileMap.json#/externalFileMap"
        },
        "additionalSpecExternalFiles": {
            "description": "external files that contain information outside of the json spec. Examples include layout, simulation, etc.",
            "type": "array",
            "items": {
                "$ref": "./common/externalFile.json#/externalFile"
            }
        },
        "reliability": {
            "description": "reliability information about the component",
            "$ref": "./common/reliability.json#/reliability"
        },
        "powerSequence": {
            "description": ". list of power sequence conditions that apply to a component",
            "type": "array",
            "items": {
                "$ref": "./common/powerSequence.json#/powerSequence"
            }
        }
    },
    "additionalProperties": false
}
